{
  "$schema": "../../system/schemas/workflowSettings.schema.json",
  "uid": "3f9c1a72-6b4d-4e18-9a2f-8c5d7e1b0a34",
  "name": "fill_contract_priority",
  "title": "01.005 Заполнение приоритетов договоров",
  "memo": "Первоначальное заполнение перечисления contract_priority стандартными значениями.",
  "isActive": true,
  "version": 2,
  "parameters": [],
  "steps": [
    {
      "expression": "workflow.fill_contract_priority.step.data.bjs",
      "uid": "a4b8c1d2-3e5f-4a67-8b9c-1d2e3f4a5b60",
      "previousStepUid": "",
      "kindUid": "dff616ce-0f40-4e44-a82b-14aa5ee2e4d6",
      "kindName": "java_script",
      "title": "Данные",
      "name": "data",
      "memo": "Подготовка DataTable со значениями приоритетов договоров.",
      "isActive": true
    },
    {
      "metaObjectKindUid": "5449a8ad-9359-41b2-8ff2-3f415eb4da76",
      "metaObjectUid": "8aeea012-aba9-426a-a6a2-b02f9d76eab6",
      "saveRegime": 1,
      "searchBy": "name",
      "sourcePath": "data",
      "condition": "",
      "createRecords": false,
      "skipHistory": false,
      "headerMapping": [
        {
          "uid": "b5c9d2e3-4f60-4b78-9c0d-2e3f4a5b6c71",
          "sourceFieldName": "name",
          "destinationFieldName": "name",
          "defaultValue": "",
          "searchBy": "",
          "dataTypeUid": "0234c067-7868-46b2-ba8e-e22fae5255cb",
          "createIfNotExist": false
        },
        {
          "uid": "c6d0e3f4-5a71-4c89-9d1e-3f4a5b6c7d82",
          "sourceFieldName": "code",
          "destinationFieldName": "code",
          "defaultValue": "",
          "searchBy": "",
          "dataTypeUid": "0234c067-7868-46b2-ba8e-e22fae5255cb",
          "createIfNotExist": false
        },
        {
          "uid": "d7e1f4a5-6b82-4d90-9e2f-4a5b6c7d8e93",
          "sourceFieldName": "title",
          "destinationFieldName": "title",
          "defaultValue": "",
          "searchBy": "",
          "dataTypeUid": "0234c067-7868-46b2-ba8e-e22fae5255cb",
          "createIfNotExist": false
        }
      ],
      "tableMapping": [],
      "uid": "e8f2a5b6-7c93-4ea1-9f30-5b6c7d8e9f04",
      "previousStepUid": "a4b8c1d2-3e5f-4a67-8b9c-1d2e3f4a5b60",
      "kindUid": "a7edd0be-6f12-4fac-b88a-4f83acc7dacb",
      "kindName": "data_object_loader",
      "title": "Загрузка данных",
      "name": "load",
      "memo": "Создание значений перечисления contract_priority. Режим Create, чтобы не задублировать уже существующие записи.",
      "isActive": true
    }
  ]
}