{
  "$schema": "../../system/schemas/workflowSettings.schema.json",
  "uid": "a1b2c3d4-e5f6-4a7b-8c9d-001122334455",
  "name": "fill_person",
  "title": "01.004 Заполнение физических лиц",
  "memo": "Первоначальное заполнение справочника физических лиц тестовыми ФИО.",
  "isActive": true,
  "version": 4,
  "parameters": [],
  "steps": [
    {
      "expression": "workflow.fill_person.step.data.bjs",
      "uid": "b2c3d4e5-f6a7-4b8c-9d0e-112233445566",
      "previousStepUid": "",
      "kindUid": "dff616ce-0f40-4e44-a82b-14aa5ee2e4d6",
      "kindName": "java_script",
      "title": "Данные",
      "name": "data",
      "memo": "Подготовка DataTable со списком физических лиц для загрузки.",
      "isActive": true
    },
    {
      "metaObjectKindUid": "032d8377-500f-4631-b435-1f7f69046674",
      "metaObjectUid": "7c3e1f92-4d8a-4b2e-9a1c-6f5e2d3b4a01",
      "saveRegime": 1,
      "searchBy": "title",
      "sourcePath": "data",
      "condition": "",
      "createRecords": false,
      "skipHistory": false,
      "headerMapping": [
        {
          "uid": "d4e5f6a7-b8c9-4d0e-1f2a-334455667788",
          "sourceFieldName": "last_name",
          "destinationFieldName": "last_name",
          "defaultValue": "",
          "searchBy": "",
          "dataTypeUid": "0234c067-7868-46b2-ba8e-e22fae5255cb",
          "createIfNotExist": false
        },
        {
          "uid": "e5f6a7b8-c9d0-4e1f-2a3b-445566778899",
          "sourceFieldName": "first_name",
          "destinationFieldName": "first_name",
          "defaultValue": "",
          "searchBy": "",
          "dataTypeUid": "0234c067-7868-46b2-ba8e-e22fae5255cb",
          "createIfNotExist": false
        },
        {
          "uid": "f6a7b8c9-d0e1-4f2a-3b4c-556677889900",
          "sourceFieldName": "middle_name",
          "destinationFieldName": "middle_name",
          "defaultValue": "",
          "searchBy": "",
          "dataTypeUid": "0234c067-7868-46b2-ba8e-e22fae5255cb",
          "createIfNotExist": false
        },
        {
          "uid": "a7b8c9d0-e1f2-4a3b-4c5d-667788990011",
          "sourceFieldName": "title",
          "destinationFieldName": "title",
          "defaultValue": "",
          "searchBy": "",
          "dataTypeUid": "0234c067-7868-46b2-ba8e-e22fae5255cb",
          "createIfNotExist": false
        }
      ],
      "tableMapping": [],
      "uid": "c3d4e5f6-a7b8-4c9d-0e1f-223344556677",
      "previousStepUid": "b2c3d4e5-f6a7-4b8c-9d0e-112233445566",
      "kindUid": "a7edd0be-6f12-4fac-b88a-4f83acc7dacb",
      "kindName": "data_object_loader",
      "title": "Загрузка данных",
      "name": "load",
      "memo": "Создание физических лиц. Режим Create — повторный запуск не задублирует существующие записи.",
      "isActive": true
    }
  ]
}